index,adult,backdrop_path,genre_ids,id,original_language,original_title,overview,popularity,poster_path,release_date,title,video,vote_average,vote_count,BBC Name
0,False,/2nYm0TrH00uJJKS020k1mNhNpUz.jpg,"[18, 10749]",152603,en,Only Lovers Left Alive,"A depressed musician reunites with his lover in the desolate streets of Detroit. Though their romance has endured several centuries, it is tested by the arrival of her capricious and unpredictable younger sister.",21.452,/kffoWJ7FfPRlFFBGixOMbq3blQp.jpg,2013-12-12,Only Lovers Left Alive,False,7.252,2069,Only Lovers Left Alive
0,False,/sfqnvsK7sG0id3MLNg0FQIgyogu.jpg,"[53, 878, 18]",97370,en,Under the Skin,A seductive stranger prowls the streets of Glasgow in search of prey: unsuspecting men who fall under her spell.,22.254,/55wmcXJIDYITr7JDijJTdvwSaAv.jpg,2014-03-14,Under the Skin,False,6.124,3232,Under the Skin
1,False,,"[18, 10770]",760343,en,Under the Skin,"""When you get to a man in the case, they're like as a row of pins - For the colonel's lady an' Judy O'Grady are sisters under their skins."" - Kipling. Polly writes for a magazine producing glamorous makeovers for young women. Befriending a member of the women's movement prompts her to re-examine her own feminist values.",0.978,/invWqz45j7hzZOQ6MR4YNnk5A49.jpg,1982-01-19,Under the Skin,False,0.0,0,Under the Skin
2,False,/1saY8VCrhrRRbsDqgkjkSo6nqpm.jpg,[18],77955,en,Under the Skin,"Although married and pregnant Rose has always been mother's favorite, it is younger sister Iris whose life is shaken up by mother's death. Suffocating, Iris spirals out of control and copes by losing herself in sexual oblivion.",3.268,/zE2EAofyZq33fWViMB6bwwHQDHw.jpg,1997-11-28,Under the Skin,False,6.3,27,Under the Skin
3,False,/57jMBWxQymcgY7uxxFEXrlIOZ3t.jpg,[99],837550,fr,"Jodie Foster, Hollywood dans la peau","From her precocious status as a sex symbol to her consecration as a filmmaker, Jodie Foster's story is about a feminist struggle, albeit atypical, fought on and off the screen. This film sets out to retrace her remarkable journey within the Hollywood industry.",6.968,/c2rx4mA19tROEmhSc03mM1X8n3O.jpg,2021-04-03,"Jodie Foster, Hollywood Under the Skin",False,7.5,16,Under the Skin
4,False,,[99],468364,en,Under the Skin,"A documentary on sixties counterculture in Japan featuring Donald Richie, Tadanori Yokoo, Masao Adachi, Koji Wakamatsu, Toshio Matsumoto and Akaji Maro among others.",0.926,/mjM8uxGrth7Jwes3sby0FrYRoAu.jpg,2002-06-14,Under the Skin,False,1.0,1,Under the Skin
5,False,,"[18, 99, 10402]",329383,fr,Le blues entre les dents,Documentary about blues musicians.,2.265,/sg0BXb1bDfK7XmBDe71RznB3IDV.jpg,1973-08-29,Blues Under the Skin,False,0.0,0,Under the Skin
6,False,/a3ZNJsoBrewHtjp5Giudbhbu7xD.jpg,"[80, 18]",340892,es,Bajo la piel,"Passion, criminal instincts and traditions melt together in this film that shakes our understanding of crime.",1.487,/swECN7YM0wHeHoKXtGFxy59p7P6.jpg,1996-10-04,Under the Skin,False,5.625,8,Under the Skin
7,False,/wmJKZDVoaiPbudPfGF6mucEDOM8.jpg,[99],719880,no,Under huden,In this documentary we follow three girls in Norway living with skin diseases.  Tonje's skin is growing 7 times faster than normal. Vilde is covered with vitiligo that makes her almost completely white. Sanna struggles with psoriasis and have been ever since she was young.,1.129,/2lJOVccdBNhEnO7tERNuU8IO3WY.jpg,2019-01-17,Under the Skin,False,6.0,1,Under the Skin
8,False,,[53],388047,it,Alessia... un vulcano sotto la pelle,"Alessia returns from the convent where she was educated to the farm where she spent her childhood. As she arrives, she starts to remember the crime that made her an orphan. The animosity she feels towards her aunt starts to get explained. Aunt Agnes was responsible for the crime, so she could get the land. Alessia starts to use her sexuality to manipulate the men around her and set a trap for her aunt as revenge.",2.22,/187x7eFjgSZi2USeqzBPhHzIMjc.jpg,1979-03-10,Alessia... A Volcano Under the Skin,False,6.2,5,Under the Skin
9,False,,[9648],135311,it,La donna del delitto,"On the little private beach of a wonderful villa on the lakeshore, Martine Chabrol, is attacked and killed. The death although mysterious, since it is related to a theft of jewels in the villa, the case is declared an accident and archived. At least until somebody decides to discover the truth and arrives at the town.",1.736,,2000-01-01,Under The Skin,False,0.0,0,Under the Skin
10,False,/aQgvGHy4GGPCTYhYL5hP57M0Opx.jpg,[18],508742,es,Tras la piel,"After years away from home, Duna returns to his home village to get reunited with his ill father. Upon arrival, she will feel rejection and misunderstanding about her trans-sexuality. Will she reconcile with her past and father?",0.6,/5CVjnNSUpM7fSf6CfJcCrwraoK3.jpg,2016-10-22,Under the Skin,False,5.0,3,Under the Skin
11,False,/eUrSqeMp8Nrlf9D1yZgIKkbCn6z.jpg,[99],667486,fr,Sous la peau,"A film about the transition of three trans teenagers, the upheaval it causes in them and their loved ones, as well as the quest for identity buried deep within them.",0.6,/uXmgcQQ5awgEpebEXvWafDaKbVH.jpg,2019-11-04,Under the Skin,False,7.5,2,Under the Skin
12,False,,[18],698232,pt,Sob a Pele,"Man and Woman are reunited after a long time. Sorrow and desire cannot break the silence. But that's okay: when words don't come, it's the body that speaks.",0.649,/kX41SU4XFBbeXvVzEb0vbzpkGgO.jpg,2013-10-19,Under the Skin,False,5.7,6,Under the Skin
13,False,/4fBMeCnGy087i1jhsCRqXvE2b8r.jpg,[18],666093,nl,Onderhuids,"The blue depths of the swimming pool is her home. Keesje is a passionate synchronised swimmer, and the big competition is just around the corner. However, when a fight erupts between the girls during the final rehearsal, everything changes.",0.926,/x4G2b02grhOdJFFwFjKXNQNImPC.jpg,2019-09-25,Under the Skin,False,0.0,0,Under the Skin
14,False,,[],938835,pt,À Flor da Pele,,0.6,,2006-04-26,Under the skin,False,0.0,0,Under the Skin
15,False,,"[99, 12]",352472,it,Il dio sotto la pelle,"An investigative film about characters who reject an existence in the world of consumerism and frenzied urbanization, seeking a new relationship with ""different"" communities and nature.",0.628,/yTQ3iIRGnTHOWfbCKTNBeX4DXfX.jpg,1974-01-01,God Under the Skin,False,0.0,0,Under the Skin
16,False,/qexobwFmCAw3Di72RCx6vtaFOhA.jpg,[16],828793,fr,"Sous la peau, l'écorce",An uninspiring character decides to visit his uninspired author.,1.39,/tC1kHrDuoDfyshSqDe7dYY78ExV.jpg,2021-06-14,"Under the Skin, the Bark",False,0.0,0,Under the Skin
17,False,,[99],991835,fa,رنج زیر پوست,"A documentary about the personal life of a movie critic and his story about his family, especially his father.",0.6,/jfg14vPW2Gw9w6Gp0YPEYN8OjfI.jpg,,Suffering Under The Skin,False,0.0,0,Under the Skin
18,False,/kldVGW81V0xJCvhCA7RaIs9JR8K.jpg,"[9648, 27]",105432,it,La pelle sotto gli artigli,"A series of brutal murders, the police on their toes, but they can not find a way to catch the sadistic murderer. A mad doctor experiments with ways to cheat death and confuse his pursuers with the help of a corpse identical DNA to his own. His young female victims are raped and brutally murdered with a knife. In the victims' fingernails will find the police traces of rotted human flesh.",1.289,/8ALeuRD5wkrGpFTVEqXT2rnIjnr.jpg,1975-05-10,The Skin Under the Claws,False,4.313,8,Under the Skin
19,False,,[],755012,sv,En stad under huden,Imaginative experimental film about the collision between a young man's inner and outer landscape.,0.6,/4cvhl6TEeoL2aTf26skyVYAlbej.jpg,1982-09-15,A City Under the Skin,False,0.0,0,Under the Skin
0,False,/7en9qwF88VfxPXsN6azHmUxRBNy.jpg,"[80, 18]",21575,fr,Un prophète,"Sentenced to six years in prison, Malik El Djebena is alone in the world and can neither read nor write. On his arrival at the prison, he seems younger and more brittle than the others detained there. At once he falls under the sway of a group of Corsicans who enforce their rule in the prison. As the 'missions' go by, he toughens himself and wins the confidence of the Corsican group.",14.673,/x9Jb8kewBHPzjTtgCQvoQoDsy4d.jpg,2009-08-26,A Prophet,False,7.587,1432,A Prophet
1,False,/iisHZVvVdKA36RYgXZx5ZfnKZMQ.jpg,[18],454610,en,Anthem of a Teenage Prophet,A small town-teen predicts his friend’s death with startling accuracy and is labelled the “Prophet of Death.” One thing he didn’t see coming? Falling in love - with his best friend’s girl.,5.785,/nBW578tMQw6XbGN7iCv43QMh8pn.jpg,2019-01-11,Anthem of a Teenage Prophet,False,6.557,35,A Prophet
2,False,/qQ6w8y43ty1J6XBu4ETnldHpERV.jpg,[99],127293,fr,Lumumba : La Mort du prophète,"Documentary about African political leader Patrice Lumumba, who was Prime Minister of Zaire (now Congo) when he was assassinated in 1961.",1.127,/x3Etu3B63W8BpVunwpjWYjTN6V5.jpg,1991-11-01,Lumumba: Death of a Prophet,False,6.8,9,A Prophet
3,False,/d7voks94AQLo2SUIrG3Ti5HYFZm.jpg,[18],42141,en,Death of a Prophet,"After breaking ties with the Nation of Islam, Malcolm X became a man marked for death...and it was just a matter of time before his enemies closed in. Despite death threats and intimidation, Malcolm marched on - continuing to spread the word of equality and brotherhood right up until the moment of his brutal and untimely assassination. Highlighted by newsreel footage and interviews, this is the story of the last twenty-four hours of Malcolm X. Featuring the music of jazz percussionist Max Roach.",3.587,/sGDfnH99iQ3X4qweXRVXK0d5SJU.jpg,1981-01-01,Death of a Prophet,False,4.222,9,A Prophet
4,False,,[99],42377,en,Muhammad: Legacy of a Prophet,"Tells the story of the seventh century prophet who changed world history in 23 years, and continues to shapes the lives of more than 1.2 billion people. The film takes viewers not only to ancient Middle Eastern sites where Muhammad's story unfolds, but into the homes, mosques and workplaces of some of America's estimated seven million Muslim to discover the many ways in which they follow Muhammad's example.",0.613,/7j1xSH4cypjQt6lPlOpXAtoOawS.jpg,2002-01-01,Muhammad: Legacy of a Prophet,False,5.4,5,A Prophet
5,False,,[18],662107,hu,Próféta voltál szívem,"During his neurological treatment, Gábor recalls his recent past. Happy moments of his marriage flash upon him, then he remembers the conflict that made his wife leave him and the women on whose side he is trying to forget.",0.633,/yZJgHs9DQHAnQHbSxAgr0tXy4rj.jpg,1969-01-01,"You Were a Prophet, My Dear",False,0.0,0,A Prophet
6,False,,[9648],749013,en,Ad-vice for a Prophet,"An anonymous narrator, alone in his apartment, cannot tell if his inner life is composed of memories of dreams or memories of reality. Using a mixture of super-8 Kodachrome and nostalgic 1980's advertisements, the film captures the way pop culture ephemera are repetitively imposed on us until we feel they are our creation.",0.6,/gtp1kAZ21F8axqdO1G2NEnTNCEG.jpg,2005-08-28,Ad-vice for a Prophet,False,0.0,0,A Prophet
7,False,,[],584703,en,"Ken Davis: A Wimpy Prophet, A Butane Bush, and No Excuses","This is a message that every Christian needs to hear! In this brand new recording of Ken's classic message, we are confronted with a Moses who reminds us an awful lot of ourselves. With his unique and insightful humor, Ken looks at the five (remarkably contemporary) excuses Moses tried to use to avoid God's call and reminds us that the answers God gave to Moses are the same answers God gives us today. A great tape for the whole family!",0.6,/d9Iy70ri87uQm5tVXbekG5PgVsE.jpg,,"Ken Davis: A Wimpy Prophet, A Butane Bush, and No Excuses",True,0.0,0,A Prophet
8,False,,[99],1056049,en,Jesiah - Portrait of a Prophet,"After the filmmaker's roommate and friend, Jesiah, abandons all of his possessions and disappears, the story left behind is one of loss, mental health, a search for purpose, and new beginnings.",0.6,/5iCGR3kNZgsNsn1XQdOK7zRJQ8m.jpg,,Jesiah - Portrait of a Prophet,False,0.0,0,A Prophet
9,False,,[16],1075395,en,The Prophet - A Passover Celebration,This animated short depicts a family celebration of Passover as seen through the eyes of two little girls. They identify the traditional symbolic dishes and are treated to a special story by their grandfather that brings to life the meaning of this important Jewish holiday.,0.6,/qKPK9uEFrQktNw6FvBviq9eYbLC.jpg,1995-12-01,The Prophet - A Passover Celebration,False,0.0,0,A Prophet
10,False,,[99],889505,pt,"Há uma Profeta Na Olaias, tenham cuidado !","In 1911, in Olaias, now a neighbourhood in Lisbon, the Portuguese Republic established itself and imposed the secularisation of the State. Meanwhile, a woman, known by the name of A. Brasileira, the Brazilian, works miracles and her persecution becomes ever more urgent. However, from one shot to the next there is magic at work here, short-circuiting the centuries.",0.6,/15VyaYqspr5n8CPIcXGaIdFiSIy.jpg,2021-07-28,A Prophet Is Among Us Watch Out!,False,0.0,0,A Prophet
11,False,,[],272347,en,The Continuing Adventures of Taraf de Haidouks: No Man Is a Prophet in His Own Land,"A Portrait of the ultimate Gypsy band Taraf de Haidouks, filmed in their village of Clejani and in Bucharest, during the recording of the 'Band of Gypsies' album.",0.6,,2009-01-01,The Continuing Adventures of Taraf de Haidouks: No Man Is a Prophet in His Own Land,False,0.0,0,A Prophet
12,False,/dHSXCqKiGnn24EhnxYVbp66gt8t.jpg,[16],283161,en,Kahlil Gibran's The Prophet,Exiled artist and poet Mustafa embarks on a journey home with his housekeeper and her daughter; together the trio must evade the authorities who fear that the truth in Mustafa's words will incite rebellion.,12.608,/iGr5sxz8XtE9KXaVLzrYSpGeWkW.jpg,2014-09-06,The Prophet,False,7.36,121,A Prophet
13,False,/xb8QO9QIFjY3bcsdn8q9jJgPXQp.jpg,[35],186629,it,Il Profeta,"In this comedy, a guru’s groupie plans to seduce him so she can number him among her many conquests.",4.717,/6jPsvsAziCgOVQF4h27532VaIcm.jpg,1968-02-15,The Prophet,False,5.559,17,A Prophet
14,False,/An91ObqKFIiFDDF0hrnPCszAzUo.jpg,"[99, 10770]",693224,de,Henry Miller – Prophet der Lüste,"The US writer Henry Miller (1891-1980), scandalous and nonconformist creator, hated by the most recalcitrant puritans, was a vilified genius, considered a threat, accused of being a sexist, of consciously pursuing the destruction of every civic principle; but he was also someone venerated as a saint, as a sex guru; and today as one of the most important characters of the twentieth century.",3.207,/1wHbaGBHYGb2evWjKhAi5AO7yBI.jpg,2017-01-25,Henry Miller: Prophet of Desire,False,0.0,0,A Prophet
15,False,/ox2OBTLycZhH0h4pYPT6TZJzLab.jpg,"[36, 18]",1029622,pl,Prorok,Cardinal Stefan Wyszynski's story sets the stage for the dramatic rise of Pope John Paul II and the fall of communism in Europe. Who is this prophetic man who battled evil and saw a son of Poland rising?,0.722,/jntO1sjs58aS3Cm15y9TiYlPDZY.jpg,2022-11-11,Prophet,False,6.5,1,A Prophet
16,False,/hcfks5JEiurINWx6Sw5Yfa30zi1.jpg,[18],282331,ko,선지자의 밤,"Yeo Ju works in a call center giving counseling to those who suffer from the hardships of life. One day, she is kidnapped by a middle-aged man who tells her of the impending apocalypse, and asks her to join him. He doesn’t strike her as dangerous or the sort that would harm her. Piece by piece, a past buried 20 years ago, reveals its secrets… KAFA presents a story of hope and despair.",1.34,/1w6JWO6W52cXuiCVSnJlTk1IWVa.jpg,2014-07-19,The Night of the Prophet,False,6.0,1,A Prophet
17,False,/SwkaYLCzLLa04hBggm6vcCTpc1.jpg,"[18, 53, 27]",331838,es,El Profeta Mimí,Childhood trauma and religious repression causes little boy to grow up and murder .,1.197,/ucpAJCs5evBVqsChZCOORYmpT0D.jpg,1973-12-27,The Prophet Mimi,False,6.3,7,A Prophet
18,False,/ht9wyfKbLLwtW5UUchjF5j1RwZc.jpg,[35],899940,es,Carlos Ballarta: falso profeta,"Mexican comic Carlos Ballarta is back, and this time, he's using his sharp black humor to challenge cultural and religious views from Latin America.",0.974,/qxAziTRy6FmLkZWl2UIhzwott1A.jpg,2021-11-18,Carlos Ballarta: False Prophet,False,6.2,5,A Prophet
19,False,/uNHd32on4vo7ewNqyawWKxu5dQz.jpg,"[28, 878]",40638,en,The Capitol Conspiracy,"Martial arts star Don ""The Dragon"" Wilson stars in this action/suspense story. A child is recruited to take part in a secret government experiment which results in him being able to see into the future. Years later, the child is an adult and is working for the government; his latest assignment is to find the other people who were part of the same project. Before long, he discovers the other test subjects usually pop up murdered shortly before he can talk to them, and he realizes he may well be the next target.",3.139,/nGnd6dUVXHgCWLg5qSfPvLDYRfp.jpg,1998-03-01,The Capitol Conspiracy,False,4.2,6,A Prophet
0,False,/eINHLmQNce1UoLuKlqKBvJK12Sd.jpg,"[18, 80]",122081,en,Spring Breakers,"After four college girls rob a restaurant to fund their spring break in Florida, they get entangled with a weird dude with his own criminal agenda.",32.543,/h3ufD3KszAl19r1gBv5wgvw4xpn.jpg,2013-01-24,Spring Breakers,False,5.222,3693,Spring Breakers
1,False,,[],1032757,fr,"""Spring Breakers"" par Jean Douchet",,0.994,/m2jMRUyb4iTH80njg289UYnXUeS.jpg,2013-12-19,"""Spring Breakers"" par Jean Douchet",False,6.0,1,Spring Breakers
2,False,/oCGPqoZtLsnLmFhc5D8QK2TEK9w.jpg,"[28, 35, 27]",408211,en,Ibiza Undead,"Three best friends - Alex, Az and Jim - head to Ibiza for their first lad's holiday. Unfortunately, tagging along is Alex's unimpressed ex-girlfriend Ellie. Arriving on the island, the lads dump Ellie with Alex's sister Liz, and her friend Zara, and head to San Antonio to start their week of sun, sea and debauchery. Soon they end up in a club, run by local gangster Karl, where the attractions aren't all alive - they're zombies! Due to Jim's drunken antics the zombies escape, and soon all hell breaks loose and no one on the party island is safe.",6.444,/cdp2OrLGFeHYhF9APKB6U4ThXoE.jpg,2017-11-02,Ibiza Undead,False,4.278,18,Spring Breakers
0,False,/6XGreAQomYnW7WcbOKvfRFYEW1D.jpg,"[18, 878]",62215,en,Melancholia,Two sisters find their already strained relationship challenged as a mysterious new planet threatens to collide with Earth.,18.582,/kd0PqvTsJd6DOY7Jxu0R4vEfpsj.jpg,2011-05-26,Melancholia,False,7.199,3315,Melancholia
1,False,/39bbP2NRqSCaMOl3aTnBXwZJgiy.jpg,[18],200785,tl,Melancholia,A story about victims of summary executions. Three people start a strange therapy to escape their agonies.,2.411,/l3mzimDOgLArXv0xOviNje84VGj.jpg,2008-08-27,Melancholia,False,7.5,19,Melancholia
2,False,,"[10749, 18]",972667,en,Melancholia,"The title sums up the mood of this elegant short film in which a woman recalls her life, locked up for 30 years in the courtyard of a building where a young man with whom she was hopelessly in love had lived. The tenants grow up, get married, die. A whole life passes.",0.6,,1961-01-01,Melancholia,False,0.0,0,Melancholia
3,False,,[],875136,en,Melancholia,A short film by James Elaine and William Basinski.,0.6,/tPB2WkxArmZDcNsj6fGCeSEEw8a.jpg,2003-01-01,Melancholia,False,0.0,0,Melancholia
4,False,/x7d0viIhCSZYdh3c3bvkAjqfqs9.jpg,[18],929281,en,Melancholia,A boy with melancholia.,0.6,/l7xGP2MwgDv4zbyq9tnkuXJGfAx.jpg,2022-01-25,Melancholia,False,0.0,0,Melancholia
5,False,,[18],223841,en,Melancholia,"Art critic Keller, a German ex-pat living in London, is confronted by his radical 1960s past when he's asked to assassinate a Chilean murderer who is on a visit to London.",1.341,/tSnOUmhSAqJEWYlduTWUThyJJSC.jpg,1989-05-19,Melancholia,False,5.0,2,Melancholia
6,False,/mHQD1cnBhs4baYTuoWeqllzHaTR.jpg,"[14, 27, 9648]",158246,de,Melancholie der Engel,"A dark secret connects middle-aged Katze and Brauth. The former has the clue that his end is near. The two meet again after years to share their last days in the old house of their past. With three women they met on their way, the atmosphere begins to recur a second time. When artist Heinrich decides to attend, the friends have their last chance to renew and cut with the history and to settle an old score. In the melancholy of the near end, Katze passes again all the situations in his life. In the hour of death, he is not alone anymore. His body is gone and his soul stays back in the same place where his destiny and fulfillment occurred.",9.042,/bMgSMrZOewzwUAo9BTOLxIKEw78.jpg,2009-05-01,The Angels’ Melancholia,False,3.9,49,Melancholia
7,False,/sIrs9MpMoTOfml0nRpWBknThTzj.jpg,[99],178469,fi,Melancholian 3 huonetta,"A searing examination of the unrelenting Chechen conflict, observed through the prisms of a Russian military boys academy, a war-torn town and a children's refugee camp.",2.164,/hq3QgZBHCvuSh5hx5uwFPIEfg9O.jpg,2004-10-08,The 3 Rooms of Melancholia,False,7.4,12,Melancholia
8,False,,[18],635207,fa,مالیخولیا,"After having medical problems, and after a long time, Mina becomes pregnant, but she feels ignored by her husband, Hesam. Since he has become concerned and involved with the personal and family problems of his colleague Shirin, who has recently divorced from her husband...",0.948,/tIWtGrs5oB5wLmF0Uq4rbcI0Fzc.jpg,2017-06-17,Melancholia,False,0.0,0,Melancholia
9,False,,[27],82828,ja,メランコリア,Following her father's death Mirai moves into a house with her uncle and his wife but finds herself lost and confused as she begins to have horrible visions. Mysteriously people around her begin dying one by one and Mirai sets off on a desperate search into her past in an attempt to find the murderer. The past uncovers a mystery that is linked to startling family secret.,1.345,,2004-10-02,Melancholia,False,5.0,1,Melancholia
10,False,,[18],1144173,en,Meditations on Melancholia,an exploration of ennui split between two worlds,0.6,/sLm29DsNq9uzUa8MSDqnn4Zb3iy.jpg,,Meditations on Melancholia,False,0.0,0,Melancholia
11,False,,[],721878,en,Aeterna melancholia,"Aeterna melacholia is a meditation about artistic creation, self investigation and hope.",0.6,/xEcBEWuVtq6Psg4aXgZuOkEYk54.jpg,2013-03-07,Aeterna melancholia,False,0.0,0,Melancholia
0,False,/sNg5mInBD52V7QdKJeP5J9InVH5.jpg,"[18, 80]",74879,tr,Bir Zamanlar Anadolu'da,"In the rural area around the Anatolian town of Keskin, the local prosecutor, police commissar, and doctor lead a search for a victim of a murder to whom a suspect named Kenan and his mentally challenged brother confessed. However, the search is proving more difficult than expected as Kenan is fuzzy as to the body's exact location. As the group continues looking, its members can't help but chat among themselves about both trivia and their deepest concerns in an investigation that is proving more trying than any of them expected.",12.052,/jKnV5JDArGn6UyrI9HiYzs7Zykn.jpg,2011-09-23,Once Upon a Time in Anatolia,False,7.49,436,Once Upon a Time in Anatolia
1,False,,[99],612174,tr,Making of Once Upon A Time in Anatolia,"A documentary about the shooting session of the film ""Once Upon A Time in Anatolia"" by Nuri Bilge Ceylan. 'Once Upon A Time in Anatolia' had been shot in about 11 weeks in the steppes of middle Anatolia close to ""Keskin"", a middle Anatolian town next to the city of Kirikkale.",1.073,/cpa1T8YHXZwQ2EgfXe3ol5fmOiu.jpg,2011-12-31,Making of Once Upon A Time in Anatolia,False,8.0,1,Once Upon a Time in Anatolia
0,False,/g2s22rGjCTCYsjI1iAflem7HjdG.jpg,"[35, 18]",9428,en,The Royal Tenenbaums,"Royal Tenenbaum and his wife Etheline had three children and then they separated. All three children are extraordinary --- all geniuses. Virtually all memory of the brilliance of the young Tenenbaums was subsequently erased by two decades of betrayal, failure, and disaster. Most of this was generally considered to be their father's fault. ""The Royal Tenenbaums"" is the story of the family's sudden, unexpected reunion one recent winter.",27.347,/3z2ZIhxcNmL0MhjtGCHRThn1WOi.jpg,2001-10-05,The Royal Tenenbaums,False,7.487,4338,The Royal Tenenbaums
1,False,/zrkw8R3mEne3ncgOz4T0frLwl65.jpg,"[99, 35]",687170,en,The Peter Bradley Show: 'The Royal Tenenbaums',"Apparently an attempt to parody the ""Charlie Rose"" show, here host Peter Bradley interviews 6 (well, 5, since one doesn't show up) of the bit players from ""The Royal Tenenbaums.""",1.666,/2H0tDTOaplSXMgBsg64e79J1cWp.jpg,2002-07-09,The Peter Bradley Show: 'The Royal Tenenbaums',False,0.0,0,The Royal Tenenbaums
2,False,/oEnPEu2ek406ejmpObruWzI6uoy.jpg,[99],1197203,en,Making The Royal Tenenbaums,A behind the scened blu-ray special featurette with pleynty of footage from the production process of The Royal Tenenbaums (2001). Director Wes Anderson comments on specific sets and small details and instructs the tech crew how and where certain changes that reflect his vision of the film should be made.,2.084,/dZPmKoFHJWk65PketYGIyleeAuz.jpg,2012-08-14,Making The Royal Tenenbaums,False,0.0,1,The Royal Tenenbaums
0,False,/vvcLSgiviCIU0J0UcwLqWdU8Iup.jpg,"[18, 10749, 10402]",824,en,Moulin Rouge!,"A celebration of love and creative inspiration takes place in the infamous, gaudy and glamorous Parisian nightclub, at the cusp of the 20th century. A young poet, who is plunged into the heady world of Moulin Rouge, begins a passionate affair with the club's most notorious and beautiful star.",23.029,/2kjM5CUZRIU5yOANUowrbJcRL9L.jpg,2001-05-24,Moulin Rouge!,False,7.576,4336,Moulin Rouge!
1,False,/dhcOfph8DLZtl6pSLOoqtwAggO0.jpg,"[18, 80, 53]",156666,en,Mystère au Moulin Rouge,In 1892 Diane arrives in Paris to search for her missing sister. To learn the fate of her sister she auditions for the quadrille at Moulin rouge.,3.167,/jWpWCS8BFTs0pgX50SqJsk6YhX5.jpg,2011-06-10,Mystery at Moulin Rouge,False,6.25,8,Moulin Rouge!
