index,adult,backdrop_path,genre_ids,id,original_language,original_title,overview,popularity,poster_path,release_date,title,video,vote_average,vote_count,BBC Name
11,False,,[99],829707,en,Catwoman: The Feline Femme Fatale,A documentary about the history of Catwoman from DC.,4.363,/ord8gdBUFitBHccX1S5RpatulA7.jpg,2021-05-05,Catwoman: The Feline Femme Fatale,False,8.222,9,Femme Fatale
12,False,/h0LvkqzLOk4B05ILhDI1BsOkboa.jpg,[10402],79010,en,Britney Spears Live The Femme Fatale Tour,"Sexy. Slammin'. Outrageous. Hurl all the adjectives you want, but one word says it all: Britney. (Ms. Spears if you're nasty.) The Grammy-winning pop diva storms the stage with a fierce mix of fan-favorite hits and hot new tracks from her latest album, Femme Fatale, in this concert special taped before a sold-out crowd in Toronto. Whether you're in the market for bodacious dance moves, killer costume changes or that make-you-melt Louisiana drawl, Britney's bringing 'em all - bigger and better than ever.",6.071,/aZ1tmEryivDUBrpxezeKlEyJ3eA.jpg,2011-11-12,Britney Spears Live The Femme Fatale Tour,False,6.7,26,Femme Fatale
13,False,,[35],52424,ko,죽어도 해피엔딩,"A gorgeous movie star invites four men to a party to choose her lover. However, they start being killed and the situation gets out of control. This comic thriller is a remake of French movie “Serial Lover”.",1.638,/7kzgoGE3QdqqME7jbVjivO60dTf.jpg,2007-08-22,Femme Fatal,False,6.1,11,Femme Fatale
14,False,,[27],537712,ja,衝撃ファイル!日本のコワ～イ女たち,"Three tales of jealousy, greed and lust about the most heinous crimes committed in Japan by women.",0.6,/2o89G4MguOquEdHldLXpOTW1REp.jpg,2011-10-28,Femmes Fatales,False,1.0,1,Femme Fatale
15,False,,[],559101,fr,La Femme fatale,"Fanny Le Doublond has a lover, Jean, and her husband is beginning to have suspicion. To calm him down she makes him believe that Jean dies of love for another woman and wants to commit suicide if his love is not returned. The two accomplices select a young creature named Claire Coussol for the (unwitting role)of the ""beloved"". As for Jean, he plays the suicidal man to perfection. But what the two lovers had not planned at all is that Claire, deeply moved by Jean's ""act of desperation"", starts growing fond of him.",0.84,/j1Q7Oi1HCfF85uMnll8KdI2odz1.jpg,1946-04-12,La Femme fatale,False,0.0,0,Femme Fatale
16,False,,[35],287101,fr,Une femme fatale,"A young, easygoing pilot discovers the mutual attraction between his chief pilot's wife and himself. The two become lovers, and are nearly discovered on several occasions. However, when the wife becomes pregnant, her husband has reason to believe he is not the father and, indeed, that the culprit is the young pilot. He arranges for the young man to have an unfortunate accident, and all proceeds as if nothing had happened.",0.847,/hpu6vTTrF0nqTPDi0ncGarSh2RR.jpg,1974-11-16,Une femme fatale,False,0.0,0,Femme Fatale
17,False,,[],1151308,fr,La Femme Fatale,"Juliette Groumet, a housemaid in a wealthy family, envies the luxury in which her employers live. Determined to live the good life one day, she is prepared to do anything to achieve her aim. Maurice, her masters' son is first to fall prey to her spell. Outright intoxicated by her, the young man puts her in a luxurious Paris apartment. But the day Maurice has squandered the last penny of the money he stole from his father Juliette leaves him and sets her sights on a rich baron. Other men - and a lot of woes - will follow until the gradual - but irredeemable - fall of the go-getter. Written by Guy Bellinger",0.6,,1912-01-01,La Femme Fatale,False,0.0,0,Femme Fatale
18,False,,[99],271935,en,Femme Fatale: Dream Within a Dream,"A documentary about Brian de Palma's ""Femme Fatale"" directed by Laurent Bouzereau.",1.808,,2003-03-25,Femme Fatale: Dream Within a Dream,False,8.7,3,Femme Fatale
19,False,,[],645883,en,She's A Femme Fatale,"roads in the middle of the night, smiling young people that sing and smoke. a young woman cries, and calm and silent trees can be seen in the back of her eyes.",0.6,,,She's A Femme Fatale,False,0.0,0,Femme Fatale
0,False,/3v7Y2bx5gSSlQGBUz9O0QX9RyRB.jpg,[18],39504,bm,Moolaadé,"When a woman shelters a group of girls from suffering female genital mutilation, she starts a conflict that tears her village apart.",3.433,/9S7lWdLExHw6LP3Vq7smiyGY5MR.jpg,2004-08-04,Moolaadé,False,7.057,61,Moolaadé
0,False,,[28],372607,en,The Assassin,The basic plot of this film concerns a secret service-esque man in Mexico battling personal demons who discovers a conspiracy behind an assassination attempt on a visiting American senator.,2.296,/dnZJ82cp148EZyOvlGevIembqnp.jpg,1990-02-21,The Assassin,False,4.667,6,The Assassin
1,False,,[28],991501,tl,The Assassin,,1.126,/rXqukQhLB0a2h2RjRlBkvvDqahd.jpg,,The Assassin,False,0.0,0,The Assassin
2,False,,[28],749944,en,The Assassin,"The assassin John has a new assignment, to take out the target in broad daylight. This task isnt to be taken lightly. Especially with the local park around the corner.",0.6,/mxeRiFlsg5QdN7Y3zVO5sAgnODy.jpg,2013-04-17,The Assassin,True,10.0,1,The Assassin
3,False,,"[53, 80]",330813,en,The Assassin,"Assassin John Brown, a heroin-addicted, recent war veteran, is hired to take out a local nightclub owner. When Brown slips, he finds himself on the run from both police and the shadowy corporation that hired him.",1.748,,2007-01-14,The Assassin,False,5.0,2,The Assassin
4,False,/5r2BZajlRZqnOc6s2BS0aiFDcne.jpg,"[28, 18, 37]",4512,en,The Assassination of Jesse James by the Coward Robert Ford,"Outlaw Jesse James is rumored to be the 'fastest gun in the West'. An eager recruit into James' notorious gang, Robert Ford eventually grows jealous of the famed outlaw and, when Robert and his brother sense an opportunity to kill James, their murderous action elevates their target to near mythical status.",33.76,/xMKn6EQS7eR5ubhPJbw5pQSBZMw.jpg,2007-09-20,The Assassination of Jesse James by the Coward Robert Ford,False,7.043,2351,The Assassin
5,False,/6cqogY7SYppI0ZNchaTKszSkxwH.jpg,"[10749, 53]",652722,es,En brazos de un asesino,"Victor (William Levy) is one of the world’s most handsome  men, but he has a deep secret – he is a cold blooded assassin. Smooth talking and seductive, Victor was raised to do one thing only, which is to kill for money. When he is sent to the home of a brutal drug lord to collect payment for his most recent hit, he encounters the beautiful Sarai (Alicia Sanz), who has been forced to spend the last 9 years of her life with the drug lord.",15.337,/iqRUOtbDunNq7gTux3zXz25Krwp.jpg,2019-12-06,In the Arms of an Assassin,False,7.879,385,The Assassin
6,False,/6I7Be7j459HgJePE7eliNZBmhaK.jpg,"[12, 18]",138503,ja,艶剣客 ～くの一媚薬責め～,"When drugs, graft and the illegal sex trade come together, the outcome can be deadly; especially in ancient Edo, where the law is dictated by he who wields the strongest sword. That's why Yasaburo, a mere commoner, spends all his spare time practicing and refining his prowess with a blade. But when Yasaburo comes to the aid of a woman he believes to be a prostitute, he soon learns that there are more kinds of weapons than he'd ever imagined... For the woman is actually Rin, a female ninja enforcer assigned to pose as a prostitute in order to investigate shipments of an illegal aphrodisiac, and the deadliest weapon in ancient Japan isn't made of steel or wood, but rather of human flesh in the form of a deadly kunoichi assassin. Get ready for the wildest eroninja film ever as three of Japan's hottest female stars - Akiho Yoshizawa, Asami and Rin Kawaii - bring Junichi Yagami's epic erotic novels of sex and steel to life in Sultry Assassin: The Aphrodisiac Kill!",4.049,/qq4dPGNS8XRgppsfR89bSmxWmu7.jpg,2010-11-23,Sultry Assassin: The Aphrodisiac Kill,False,4.8,14,The Assassin
7,False,,[99],17171,en,The Assassination of Jesse James: Death Of An Outlaw,"Explores the true story of the notorious Jesse James, how the myth developed during his lifetime, and how the legends have persisted over 100 years after his death at the hands of his former friend, Robert Ford.",4.743,,2008-03-31,The Assassination of Jesse James: Death of an Outlaw,True,6.657,67,The Assassin
8,False,/b4fVPXpnjcet48IgpDYkkdVZX3L.jpg,"[53, 36]",152635,fr,L'Attentat,"Darien, a left-wing police informant, is forced to lure his old friend Sadiel to Paris, allegedly to film a television special about the Third World. Sadiel, the exiled leader of a North African state, is being hunted by the ruthless Colonel Kassar, who will stop at nothing to capture his political rival. Once Sadiel arrives in Paris, Darien realizes he has been manipulated. He tries to turn back the clock, not realizing what or who he’s truly dealing with.",5.866,/pcwij6QBlf1DOTAUxw1YsjwhQFU.jpg,1972-10-04,The Assassination,False,6.567,30,The Assassin
9,False,/wGIypSW7q4k98sBHsKXGuH5akxf.jpg,"[18, 36]",136701,zh,铜雀台,"In the year 198, Cao Cao, Prime Minister of the Han Dynasty, ventured to the east and defeated China's greatest warrior Lu Bu, terrifying every ambitious warlord across the country. Several years later, after taking the Han Emperor under his wing, Cao crowns himself King of Wei. He built a magnificent Bronze Sparrow Island to symbolize his power and rumors spread that he would replace the Emperor. Meanwhile, young lovers Mu Shun and Ling Ju are taken from a prison camp to a hidden tomb, where they spend five cruel years together, training as assassins for a secret mission. In the year 220 astronomical signs predict dramatic change. As a result, Cao's son Cao Pi and Cao's followers urge Cao to become the new Emperor - but unknown opposing forces plot against him.",11.962,/iflthXJoh1jDND6CWCrEAG9JgwT.jpg,2012-09-26,The Assassins,False,5.555,55,The Assassin
10,False,/vbzV4SdWURDHvl8o0ZfrxvaTzc7.jpg,"[28, 16, 35]",431808,ja,劇場版「暗殺教室」365日の時間,"A compilation film of the Ansatsu Kyoushitsu TV series, featuring anime-only epilogue scenes not originally in the manga.",13.254,/7VCCGzXRxceMWQir41HpGhiqHBz.jpg,2016-11-19,Assassination Classroom the Movie: 365 Days' Time,False,6.619,59,The Assassin
11,False,/oHX5Abgjy7GLZWJaqQ54p8GsQvl.jpg,"[28, 18, 36]",253450,zh,刺客聶隱娘,"9th century China. 10-year-old general’s daughter Nie Yinniang is abducted by a nun who initiates her into the martial arts, transforming her into an exceptional assassin charged with eliminating cruel and corrupt local governors. One day, having failed in a task, she is sent back by her mistress to the land of her birth, with orders to kill the man to whom she was promised – a cousin who now leads the largest military region in North China. After 13 years of exile, the young woman must confront her parents, her memories and her long-repressed feelings.",17.506,/6OizMjnSQ8oZtMQuiK7opIawcM3.jpg,2015-08-27,The Assassin,False,6.456,478,The Assassin
12,False,/xQZCErvAiznVtnFVHVhfYbwlCXU.jpg,"[9648, 53]",478100,fr,La Femme la plus assassinée du monde,"Set against the backdrop of the infamous Theatre Grand Guignol the story revolves around iconic actress Paula Maxa - the most famous of the Grand Guignol's leading ladies and the titular Most Assassinated Woman, who was graphically slain on stage multiple times a day.",9.161,/tC4IfhFv84CxC19BXN3678IeNRN.jpg,2018-09-07,The Most Assassinated Woman in the World,False,5.3,93,The Assassin
13,False,/aAKUY85PzNJXG4F1WWHfw6TopzG.jpg,"[36, 80, 18]",38080,fr,Le Juge et l'Assassin,"France, 1893. Joseph Bouvier attempts to shoot his love who refused to marry him and to commit suicide. Upon release from the filthy asylum where he was placed, with bullets still remaining in his head, he wanders the country roads and rapes and murders many teenagers over years. The judge Rousseau captures him, but to serve his ambition seeks to avoid that Bouvier is simply declared insane.",8.05,/2FwFJvyktddFy8eJc9jMmn6efYv.jpg,1976-03-10,The Judge and the Assassin,False,6.94,117,The Assassin
14,False,/gXvmhujLzYRXMQPZNBDFUD3RnEg.jpg,"[18, 36, 53, 80]",842,en,The Assassination of Richard Nixon,"It’s 1974 and Sam Bicke has lost everything. His wife leaves him with his three kids, his boss fires him, his brother turns away from him, and the bank won’t give him any money to start anew. He tries to find someone to blame for his misfortunes and comes up with the President of the United States who he plans to murder.",10.084,/5jOOvAVvP0XtwC5yYQpQCy4cjq1.jpg,2004-05-17,The Assassination of Richard Nixon,False,6.5,269,The Assassin
15,False,/s8J0aq227wyA1VTojCy3zihlsyh.jpg,"[36, 18]",10387,zh,荆轲刺秦王,"In pre-unified China, the King of Qin sends his concubine to a rival kingdom to produce an assassin for a political plot, but as the king's cruelty mounts she finds her loyalty faltering.",10.448,/hroNcPp2cn6mMWcYpkEud2GY78f.jpg,1998-10-08,The Emperor and the Assassin,False,6.914,76,The Assassin
16,False,/txnNf3NyPG5xf5ro96y2Bq9AHmr.jpg,"[80, 18, 10749]",44321,es,La virgen de los sicarios,"World-weary author Fernando has returned to his native Colombia to live out his days in peace.  But Fernando's once-quiet hometown has become a hotbed of violence, drugs, and corruption.  On the brink of despair, Fernando meets Alexis, a beautiful but hardened street kid who lives by the rule of the gun.  Together, they forge an unlikely relationship.",8.256,/q5jT6BBCIWIysr712UIZY7BOGje.jpg,2000-09-01,Our Lady of the Assassins,False,7.236,159,The Assassin
17,False,/g3RrjihLAMiHpnNfGGO1oNSKGNL.jpg,[28],890154,ko,살수,An action historical drama depicting the story of Joseon's best swordsman Yi Nan in front of an irreversible fate.,11.799,/ulobyNR62zvI1cKUk1YJ9QwKGkb.jpg,2023-02-22,The Assassin,False,5.522,23,The Assassin
18,False,/uxYCY2cOUZXpcIztNkqIcmWVjc4.jpg,"[80, 35, 12]",69526,en,The Assassination Bureau,"In 1908 London, a women's rights campaigner discovers the Assassination Bureau Limited, an organization that kills for justice. When its motives are called into question, she commissions the assassination of its chairman. Knowing that his colleagues have recently become more motivated by greed than morality, he turns the situation into a challenge for his board members: kill him or be killed.",8.597,/mAQ8z14i2UyAd3NrMFxbeGz6Kpj.jpg,1969-03-09,The Assassination Bureau,False,6.3,57,The Assassin
19,False,/3OoSoGDK1DI26MRSoJhv5chmV5X.jpg,"[28, 12, 16, 10770, 80, 18]",31599,ja,ルパン三世『ワルサーP38』,"Lupin is framed for the murder of Inspector Zenigata by a mysterious assailant holding a silver-coloured Walther P38 pistol Lupin himself once owned. Tracking the true killer leads Lupin to the island of the bloodthirsty Tarantula assassins inside the Devil’s Triangle. After joining the spider-tattooed army against their will, Lupin and his gang make both new friends and enemies as they not only plan to take home the Tarantulas’ massive gold repository for themselves, but hunt down the shooter from Lupin’s past. Can Lupin put to rest this demon who haunts his memories with the Walther P38?",8.29,/cs9hg2Fe6rV7230Bpxl58MtY4E8.jpg,1997-08-01,Lupin the Third: Island of Assassins,False,6.565,54,The Assassin
0,False,/kt0Ku4cTQUZe4KyZiWC6HsWCbcS.jpg,[35],496,en,Borat: Cultural Learnings of America for Make Benefit Glorious Nation of Kazakhstan,"Kazakh journalist Borat Sagdiyev travels to America to make a documentary. As he zigzags across the nation, Borat meets real people in real situations with hysterical consequences. His backwards behavior generates strong reactions around him exposing prejudices and hypocrisies in American culture.",16.69,/kfkyALfD4G1mlBJI1lOt2QCra4i.jpg,2006-11-01,Borat: Cultural Learnings of America for Make Benefit Glorious Nation of Kazakhstan,False,6.773,5095,Borat: Cultural Learnings of America for Make Benefit Glorious Nation of Kazakhstan
0,False,/zxxmSDnl5OwIxOmWQbgPvjmSRv3.jpg,"[18, 10749]",27904,th,แสงศตวรรษ,"A story about director Apichatpong Weerasethakul’s parents who were both doctors, and his memories of growing up in a hospital environment.",6.272,/1XUMd93PRMUkCtE2NWn0zQb1NC6.jpg,2006-08-31,Syndromes and a Century,False,6.8,77,Syndromes and a Century
0,False,/kUa5p73cjzDXoqB6SKncfYKmMu2.jpg,[18],24469,en,Fish Tank,"Mia is a rebellious teenager on the verge of being kicked out of school. Her hard-partying mother, Joanne, neglects Mia's welfare in favor of her own, and her younger sister hangs out with a much older crowd. Sparks fly between Mia and Connor, Joanne's new boyfriend, and he encourages Mia to pursue her interest in dance. As the boundaries of the relationships become blurred, Mia and Joanne compete for Connor's affection.",19.383,/rI3MKBDsWzQHi9PWDAMKkgmYcff.jpg,2009-09-11,Fish Tank,False,6.965,790,Fish Tank
1,False,/wm1WFe4Rs0qRFrmhS7F8Xi79WHd.jpg,"[18, 10749, 53, 27]",530842,en,Fish Tank,"When a college student goes to his first hook-up with a mysterious older man, he must determine if his anxieties point to a darker truth about his host for the night.",1.922,/yBCuja2jIAl3IRwqAwa5OcsOBwR.jpg,2018-06-08,Fish Tank,False,5.3,3,Fish Tank
2,False,/5z4jsCf0UIDVbHLERzjcdUyF6d5.jpg,[18],1023084,ja,水槽,"After school, the protagonist falls in love with a male student he sees in the library, and impulsively chases after him. In an attempt to save him, she wanders through a snowy world. When the camera captures her every move and outpouring of emotion, a vivid poetry emerges.",0.6,/uxUjRyJfec5oeRqGGsr2FWGsRLZ.jpg,2022-09-10,Fish Tank,False,0.0,0,Fish Tank
3,False,,[],618683,zh,魚缸,The Family decided to reunite for one last time before the daughter moves away overseas for work. But the father unexpectedly brings his new partner along to the party.,1.101,/xJPpbIAV567KwzIbHlwUVsXBOEg.jpg,2016-11-23,Fish Tank,False,0.0,0,Fish Tank
4,False,,[18],845912,zh,你剛才說的是笑話嗎？,"Chuan never have more thought aside from working, eating, and his empty dorm room. One day, his junior high school classmate who had never contact after graduate, Yu Hsiang, appeared. He told Chuan he could take him to see Bau-Wen, the girl he once had a crash on. Even all those came in sudden, making he confused, he still wanted to see Bau-Wen again.",0.6,/eQwGL8v5bQe4bNeKndE6scq5Qqv.jpg,2020-10-09,Fish Tank,False,0.0,0,Fish Tank
5,False,,[35],1111148,en,But You Can’t Take the Fish Out of the Tank,"As a loose cord dangles over a row of fish tanks,  the inhabitants decide to record their last days as a message to careless electricians.",0.6,,,But You Can’t Take the Fish Out of the Tank,False,0.0,0,Fish Tank
6,False,/yO6mKC1jGTQqGLuEbNBDmMjaaYM.jpg,"[18, 10749]",640017,en,Two Fish,Max is spending his summer on campus. A lonely place in maintenance. His best friend Taylor comes back from Europe and their relationship takes a new turn.,0.627,/qZFCt7F6k5dX5nsNQVUAViSRhZj.jpg,2017-10-21,Two Fish,False,1.0,1,Fish Tank
0,False,/xVIHZXRFnImt0z88PWsUNH9EPq7.jpg,[99],435092,en,Birdman,"A portrait of Robert, a troubled but poetic soul struggling with his purgatorial existence in a hackney scrapyard.",0.6,/9n0u3Ee7OUjgeyF5kIwahxkf4xm.jpg,2015-07-01,Birdman,False,3.6,5,Birdman
1,False,,[],875169,en,Birdman,"BIRDMAN uses almost random extracts from Ludwig Koch's book, ""Memoirs of a Birdman"" to create a radical experimental work, loosely inspired by aspects of Brechtian epic theatre.",0.6,,,Birdman,False,0.0,0,Birdman
2,False,/pDqwUJJSaHIv2sxyRYfmYBFeU9C.jpg,"[18, 35]",194662,en,Birdman or (The Unexpected Virtue of Ignorance),"A fading actor best known for his portrayal of a popular superhero attempts to mount a comeback by appearing in a Broadway play. As opening night approaches, his attempts to become more altruistic, rebuild his career, and reconnect with friends and family prove more difficult than expected.",40.262,/rHUg2AuIuLSIYMYFgavVwqt1jtc.jpg,2014-10-17,Birdman or (The Unexpected Virtue of Ignorance),False,7.467,12398,Birdman
3,False,/4tg7CSC51y3xUv56v1kTGe4xg9Y.jpg,"[18, 80, 36]",898,en,Birdman of Alcatraz,"After killing a prison guard, convict Robert Stroud faces life imprisonment in solitary confinement. Driven nearly mad by loneliness and despair, Stroud's life gains new meaning when he happens upon a helpless baby sparrow in the exercise yard and nurses it back to health. Despite having only a third grade education, Stroud goes on to become a renowned ornithologist and achieves a greater sense of freedom and purpose behind bars than most people find in the outside world.",18.973,/6EODLN11HTX4l2cmakAhWIoJLF.jpg,1962-07-04,Birdman of Alcatraz,False,7.5,267,Birdman
4,False,,[28],394750,ja,赤胴鈴之助　三つ目の鳥人,Suzunosuke faces perhaps his wildest foes. This evil gang is lead by a one-eyed birdman and other demonic creatures.,1.463,,1958-03-11,Akado Suzunosuke vs. the Birdman with 3 Eyes,False,0.0,0,Birdman
5,False,,"[18, 10749, 35]",550693,id,Aku Ingin Menciummu Sekali Saja,"A Papuan boy meets a woman and becomes obsessed with wanting to kiss her. At the same time, his father is being hunted down because of his political activities.",0.767,/tH7yedhO7ld7M1DxgZ8pClVnXVW.jpg,2004-02-01,Birdman Tale,False,5.3,3,Birdman
6,False,,[99],356233,pt,Homem-Ave,"The vertigos in the urban landscape take the Bird-Man back to his origins, in a metaphor about life cycles. ""Bird-Man"" is a film from the poetic nature of Brazilian singer, Ney Matogrosso. During the 1970s dictatorship, he broke sexual taboos with a ""strange"" behavior on stage and became one of the most famous brazilian singers. Inspired in Cassiano Ricardo's concrete poems and the experimental music of Ney's repertoire, ""Bird-Man"" explores a sound and visual lyrical aesthetic of high contrasts that approximates man to nature's feelings.",0.6,/a8g3txR6a4K80vgko7LhKsbXcrc.jpg,2010-08-26,Bird-Man,False,10.0,1,Birdman
7,False,/vaNcnuLNiNRPt9bbeTmdBXFw31W.jpg,[16],859292,ja,パーマン バードマンがやって来た!!,,0.876,/3C5zhRK2lYYbiw5ftn9xc7227lp.jpg,1983-03-12,Perman: Birdman ga Yatte Kita!!,False,0.0,0,Birdman
8,False,,[99],562517,en,Birdman: All-Access (A View From the Wings),"A making-of documentary for the 2014 film ""Birdman"".",1.645,/78gMxjXcUTbyD0L7c4bACEuSgyM.jpg,2015-05-18,Birdman: All-Access (A View From the Wings),True,7.2,4,Birdman
9,False,,[99],1204780,ro,Omul Pasăre,"An old aviator fights to stay in the air. Whether he wins or not, his participation will mark a new record for aviation and will allow one more armistice in his battle with time.",0.624,/ow9irmnKLcQf61DTrg0NpWnL5xI.jpg,2014-10-23,The Birdman,False,6.0,1,Birdman
10,False,/bOAvotGaQedrxZ9LbMBSiDkqGDA.jpg,"[35, 16, 10770]",554115,en,"Harvey Birdman, Attorney General","Newly appointed Attorney General, Harvey Birdman, attempts to use his position to get President Phil Ken Sebben removed from office.",2.208,/oCqdDDwxK7aVnWomtoQ4IJOVOqq.jpg,2018-10-15,"Harvey Birdman, Attorney General",False,7.5,4,Birdman
11,False,,[99],820966,en,Illusion of Freedom: Richard H. Kline on John Frankenheimer's Birdman of Alcatraz,"A first-hand account of the shooting of John Frankenheimer's The Birdman of Alcatraz by the film's camera operator, Richard H. Kline, ASC.",2.055,,2018-08-06,Illusion of Freedom: Richard H. Kline on John Frankenheimer's Birdman of Alcatraz,False,0.0,0,Birdman
12,False,,"[10402, 99]",466930,en,Descent Into the Maelstrom: The Untold Story of Radio Birdman,Documentary that chronicles the career of the legendary Australian punk band Radio Birdman.,0.6,/t2pfxp908edCu4gLcNBT5OqujmK.jpg,2017-07-20,Descent Into the Maelstrom: The Untold Story of Radio Birdman,False,6.0,1,Birdman
13,False,,[27],1127894,en,Birdemic 5: Birdman,Plot details are currently under wraps but expect another bird attack.,1.289,/pLNflwomktVRbsNC7OMSbAR30iP.jpg,2027-01-01,Birdemic 5: Birdman,False,0.0,0,Birdman
14,False,/3oWNc89RrowCMWuhJshYOJyCNUI.jpg,[99],679921,en,The Birdman,"The story of an ornithologist who’s remarkable work is safeguarding the future of not just birds but reptiles, mammals and one day perhaps even humans. When scientists declared the Mauritius Kestrel beyond salvation, one young biology graduate refused to let it become another obsolete species.",0.602,/deNb9LsdT1W320rXaGxZGsPYhOd.jpg,2020-01-20,The Birdman,False,0.0,0,Birdman
15,False,,[],812035,en,Birdman of Pollok/Curaidh na Coille,"Colin Macleod was a modern-day land raider who gave a voice to the people of Pollok in the 90s. The M77 was being driven through their park, cutting the local community off from their only green space. Instead of Greta Thunberg or Extinction Rebellion, they had Colin Macleod. He started by staying up a tree for nine days to grab press attention. This grew into a full-blown protest camp and the Pollok Free State was born.",0.6,,,Birdman of Pollok/Curaidh na Coille,False,0.0,0,Birdman
16,False,,[16],242506,en,The Balgonie Birdman,This film tells the story of the efforts of the first Canadian to attempt to fly a human powered heavier than air aircraft,0.6,,1991-12-28,The Balgonie Birdman,False,0.0,0,Birdman
17,False,,[16],1147609,en,Voyager Birdman,"Voyager Birdman is a frame-by-frame experimental animation made from simple spontaneous line drawings, rotoscoped video clips, and views of the highway filmed between Pennsylvania and West Virginia. Sounds of podcast voices, old radio programs, Nasa recordings, and sampled audio files carried by the Voyager space probes launched in the late 1970’s merge with an unfolding stream of hand-drawn symbols, figures, abstractions, and fragments of the passing highway landscape. On one level, it’s about the idea of using drawing, animation and collage to find and create meaning. More directly, it’s an attempt to capture the fleeting dynamics of thoughts, memories and dreams experienced on a long night’s drive - much like the virtual and untethered character of contemporary existence - and the enduring lure of an interstellar connection.",0.6,,2023-03-16,Voyager Birdman,False,0.0,0,Birdman
